{
  "schemaVersion" : "matching.m14.mutants.v1",
  "unit" : "M14",
  "contractPlanVersion" : "0.17",
  "startCommit" : "96b749861292950749701e34a6f20796f239cd4b",
  "workloadSha256" : "005afdabc720ab782ea092e416a7d9c1273daf09246eede1e43607ed110ad9e3",
  "profileSha256" : "02ef0ee44900e1a472fea03ed5cb406215550994826b53f4b708e33815c6be9d",
  "primitiveCountMeaning" : "Concrete workload transition, read, capture, restore, frame and sink steps; oracle evaluation and diagnostic image reads are validation observations.",
  "candidates" : [ {
    "id" : "M14-MAKER-ACCOUNT-FROM-TAKER",
    "status" : "STUDENT_FAILURE",
    "failure" : "independent exact Execution bytes",
    "actualMutationActions" : 1,
    "primitiveAttempts" : 4,
    "assertions" : 30,
    "rawFile" : "M14-MAKER-ACCOUNT-FROM-TAKER.jsonl.gz",
    "rawSha256" : "fc237426d4dfdc6ad0ad460db86d177e2b1d664299f69ec50b36f56d5c82748c",
    "rawBytes" : 5510,
    "proofObligations" : [ "ACTUAL_SEMANTIC_BOUNDARY" ],
    "classification" : "STUDENT_FAILURE",
    "countedAsKill" : true,
    "control" : {
      "id" : "M14-MAKER-ACCOUNT-FROM-TAKER-CONTROL",
      "status" : "PASS",
      "failure" : "",
      "actualMutationActions" : 0,
      "primitiveAttempts" : 4,
      "assertions" : 49,
      "rawFile" : "M14-MAKER-ACCOUNT-FROM-TAKER-CONTROL.jsonl.gz",
      "rawSha256" : "fd7156e25e2ebae45c62ce7d6338b0eeda1be77b1c390aff6232bc15fa88f24c",
      "rawBytes" : 5633,
      "proofObligations" : [ "PRODUCTION_CONTROL" ]
    }
  }, {
    "id" : "M14-PRIVATE-ACCOUNT-IN-MARKET",
    "status" : "STUDENT_FAILURE",
    "failure" : "independent exact Market bytes",
    "actualMutationActions" : 1,
    "primitiveAttempts" : 4,
    "assertions" : 32,
    "rawFile" : "M14-PRIVATE-ACCOUNT-IN-MARKET.jsonl.gz",
    "rawSha256" : "16843ee7a8dfd73af2f3051ad9c35e0a6d6faf4631465c76b7f1bf3ffa3e84b4",
    "rawBytes" : 5793,
    "proofObligations" : [ "ACTUAL_SEMANTIC_BOUNDARY" ],
    "classification" : "STUDENT_FAILURE",
    "countedAsKill" : true,
    "control" : {
      "id" : "M14-PRIVATE-ACCOUNT-IN-MARKET-CONTROL",
      "status" : "PASS",
      "failure" : "",
      "actualMutationActions" : 0,
      "primitiveAttempts" : 4,
      "assertions" : 49,
      "rawFile" : "M14-PRIVATE-ACCOUNT-IN-MARKET-CONTROL.jsonl.gz",
      "rawSha256" : "48039b3cb8a45f0887f86134bfa77bcf7c6c14a5b61331549a5ebb4fd8fd5053",
      "rawBytes" : 5806,
      "proofObligations" : [ "PRODUCTION_CONTROL" ]
    }
  }, {
    "id" : "M14-DUPLICATE-CREATES-BATCH",
    "status" : "STUDENT_FAILURE",
    "failure" : "retry/conflict preserves full image",
    "actualMutationActions" : 1,
    "primitiveAttempts" : 4,
    "assertions" : 22,
    "rawFile" : "M14-DUPLICATE-CREATES-BATCH.jsonl.gz",
    "rawSha256" : "87c8005657f5939ec391bc91ff9e34da2447b9920dd1ebea54a1ae449422f0bd",
    "rawBytes" : 6745,
    "proofObligations" : [ "ACTUAL_SEMANTIC_BOUNDARY" ],
    "classification" : "STUDENT_FAILURE",
    "countedAsKill" : true,
    "control" : {
      "id" : "M14-DUPLICATE-CREATES-BATCH-CONTROL",
      "status" : "PASS",
      "failure" : "",
      "actualMutationActions" : 0,
      "primitiveAttempts" : 4,
      "assertions" : 24,
      "rawFile" : "M14-DUPLICATE-CREATES-BATCH-CONTROL.jsonl.gz",
      "rawSha256" : "1579f3194bc8feda8574b635416ecb471692cccd6ed052dd8acb341204498334",
      "rawBytes" : 3278,
      "proofObligations" : [ "PRODUCTION_CONTROL" ]
    }
  }, {
    "id" : "M14-ACK-ACCEPTS-FUTURE",
    "status" : "STUDENT_FAILURE",
    "failure" : "rejected/replayed control preserves image",
    "actualMutationActions" : 1,
    "primitiveAttempts" : 5,
    "assertions" : 34,
    "rawFile" : "M14-ACK-ACCEPTS-FUTURE.jsonl.gz",
    "rawSha256" : "52bb508014a476e2c3c916aa7f32f849bbdb5e1a7ed19ec47f8aae24b6d72487",
    "rawBytes" : 7930,
    "proofObligations" : [ "ACTUAL_SEMANTIC_BOUNDARY" ],
    "classification" : "STUDENT_FAILURE",
    "countedAsKill" : true,
    "control" : {
      "id" : "M14-ACK-ACCEPTS-FUTURE-CONTROL",
      "status" : "PASS",
      "failure" : "",
      "actualMutationActions" : 0,
      "primitiveAttempts" : 5,
      "assertions" : 36,
      "rawFile" : "M14-ACK-ACCEPTS-FUTURE-CONTROL.jsonl.gz",
      "rawSha256" : "0b6d847b97c0033424cac3a4d8e99f083efcdaee667166cfbb3a38dbc509f21b",
      "rawBytes" : 3713,
      "proofObligations" : [ "PRODUCTION_CONTROL" ]
    }
  }, {
    "id" : "M14-MARKET-SNAPSHOT-CUT-OFF-BY-ONE",
    "status" : "STUDENT_FAILURE",
    "failure" : "independent whole-shard snapshot bytes",
    "actualMutationActions" : 1,
    "primitiveAttempts" : 3,
    "assertions" : 15,
    "rawFile" : "M14-MARKET-SNAPSHOT-CUT-OFF-BY-ONE.jsonl.gz",
    "rawSha256" : "3358fa7841ff81aa42f1c53b647e657280234d6c39f2635dbaa9bdcadaeaa40f",
    "rawBytes" : 4137,
    "proofObligations" : [ "ACTUAL_SEMANTIC_BOUNDARY" ],
    "classification" : "STUDENT_FAILURE",
    "countedAsKill" : true,
    "control" : {
      "id" : "M14-MARKET-SNAPSHOT-CUT-OFF-BY-ONE-CONTROL",
      "status" : "PASS",
      "failure" : "",
      "actualMutationActions" : 0,
      "primitiveAttempts" : 3,
      "assertions" : 37,
      "rawFile" : "M14-MARKET-SNAPSHOT-CUT-OFF-BY-ONE-CONTROL.jsonl.gz",
      "rawSha256" : "125340e8a1f65c55a2a1aae26aba0933da0ae6d3d19ec3ede30fa44a6983e84d",
      "rawBytes" : 3960,
      "proofObligations" : [ "PRODUCTION_CONTROL" ]
    }
  }, {
    "id" : "M14-STALE-PUBLISHER-ACCEPTED",
    "status" : "STUDENT_FAILURE",
    "failure" : "stale publisher cannot advance after trusted install",
    "actualMutationActions" : 1,
    "primitiveAttempts" : 8,
    "assertions" : 48,
    "rawFile" : "M14-STALE-PUBLISHER-ACCEPTED.jsonl.gz",
    "rawSha256" : "0bb1989bec0116e8935f30098485fed9b144333d37da8244803ef2939fbf18b5",
    "rawBytes" : 4604,
    "proofObligations" : [ "ACTUAL_SEMANTIC_BOUNDARY" ],
    "classification" : "STUDENT_FAILURE",
    "countedAsKill" : true,
    "control" : {
      "id" : "M14-STALE-PUBLISHER-ACCEPTED-CONTROL",
      "status" : "PASS",
      "failure" : "",
      "actualMutationActions" : 0,
      "primitiveAttempts" : 12,
      "assertions" : 53,
      "rawFile" : "M14-STALE-PUBLISHER-ACCEPTED-CONTROL.jsonl.gz",
      "rawSha256" : "0743d1a17e64e4765237490737cd0bde15eaf3b892aa3f93be708e3e150ccdea",
      "rawBytes" : 4892,
      "proofObligations" : [ "PRODUCTION_CONTROL" ]
    }
  }, {
    "id" : "M14-CAPACITY-REJECT-AFTER-LIVE-APPLY",
    "status" : "STUDENT_FAILURE",
    "failure" : "refusal preserves full state/identity/output",
    "actualMutationActions" : 1,
    "primitiveAttempts" : 39,
    "assertions" : 1215,
    "rawFile" : "M14-CAPACITY-REJECT-AFTER-LIVE-APPLY.jsonl.gz",
    "rawSha256" : "ab9dd58eada936aa206f91baa5232cd0a5dad256ce1bbe7ced9aded13a7ebceb",
    "rawBytes" : 61005,
    "proofObligations" : [ "ACTUAL_SEMANTIC_BOUNDARY" ],
    "classification" : "STUDENT_FAILURE",
    "countedAsKill" : true,
    "control" : {
      "id" : "M14-CAPACITY-REJECT-AFTER-LIVE-APPLY-CONTROL",
      "status" : "PASS",
      "failure" : "",
      "actualMutationActions" : 0,
      "primitiveAttempts" : 101,
      "assertions" : 1586,
      "rawFile" : "M14-CAPACITY-REJECT-AFTER-LIVE-APPLY-CONTROL.jsonl.gz",
      "rawSha256" : "350b58e7d6b2bb2647c8e44a2b79dc5718501bf996823fafb03330226fd45306",
      "rawBytes" : 68858,
      "proofObligations" : [ "PRODUCTION_CONTROL" ]
    }
  }, {
    "id" : "M14-SNAPSHOT-DROPS-OUTPUT-BINDING",
    "status" : "STUDENT_FAILURE",
    "failure" : "snapshot retains original output commitment 5400bf6f-03d0-3176-8e33-36fa7fc442da",
    "actualMutationActions" : 1,
    "primitiveAttempts" : 4,
    "assertions" : 22,
    "rawFile" : "M14-SNAPSHOT-DROPS-OUTPUT-BINDING.jsonl.gz",
    "rawSha256" : "df908cbec2730862a6cae30d71251645216976e11c5941fade689f2e7ce6f7e4",
    "rawBytes" : 6270,
    "proofObligations" : [ "ACTUAL_SEMANTIC_BOUNDARY" ],
    "classification" : "STUDENT_FAILURE",
    "countedAsKill" : true,
    "control" : {
      "id" : "M14-SNAPSHOT-DROPS-OUTPUT-BINDING-CONTROL",
      "status" : "PASS",
      "failure" : "",
      "actualMutationActions" : 0,
      "primitiveAttempts" : 4,
      "assertions" : 23,
      "rawFile" : "M14-SNAPSHOT-DROPS-OUTPUT-BINDING-CONTROL.jsonl.gz",
      "rawSha256" : "fc430c0019122489236dd402e5eaf6e697f4727381790d1c1c1e3953c71d15c1",
      "rawBytes" : 5969,
      "proofObligations" : [ "PRODUCTION_CONTROL" ]
    }
  } ],
  "systemErrorControls" : [ {
    "id" : "M14-THROWING-CONTROL",
    "status" : "SYSTEM_ERROR",
    "failure" : "java.lang.IllegalStateException: explicit throwing semantic control",
    "actualMutationActions" : 1,
    "primitiveAttempts" : 3,
    "assertions" : 0,
    "rawFile" : "M14-THROWING-CONTROL.jsonl.gz",
    "rawSha256" : "02b4eade09e70911d7b27b0dec8d46ae61bb98f72245fa52b6068394c017dd7d",
    "rawBytes" : 1436,
    "proofObligations" : [ "THROWING_IS_NOT_KILL" ],
    "classification" : "SYSTEM_ERROR",
    "countedAsKill" : false
  }, {
    "id" : "M14-CORRUPT-CHILD-REPORT",
    "status" : "SYSTEM_ERROR",
    "failure" : "io.github.lchareln.cex.matching.testkit.FixtureSchemaException: JSON Schema rejected document: [: 架构中未定义属性“invented”，并且架构不允许附加属性, : 未找到所需属性“scenarios”, : 未找到所需属性“executedScenarios”, : 未找到所需属性“passedScenarios”, : 未找到所需属性“primitiveAttempts”, : 未找到所需属性“assertions”]",
    "actualMutationActions" : 0,
    "primitiveAttempts" : 2,
    "assertions" : 0,
    "rawFile" : "M14-CORRUPT-CHILD-REPORT.jsonl.gz",
    "rawSha256" : "69946f0ed07db704080d76a635073ddc8886ce7f7999cf956561bd451c6b2089",
    "rawBytes" : 1014,
    "proofObligations" : [ "SCHEMA_ERROR_IS_NOT_KILL" ],
    "classification" : "SYSTEM_ERROR",
    "countedAsKill" : false
  }, {
    "id" : "M14-MISSING-BOUND-RAW-ARTIFACT",
    "status" : "SYSTEM_ERROR",
    "failure" : "java.lang.IllegalStateException: missing or changed originally judged raw artifact",
    "actualMutationActions" : 0,
    "primitiveAttempts" : 2,
    "assertions" : 0,
    "rawFile" : "M14-MISSING-BOUND-RAW-ARTIFACT.jsonl.gz",